$U UMOSI NINGA, AOLE WANTU. Uma pessoa só é uma sombra, Duas são pessoas.$ 
«Melhor é serem dois do que um, porque têm melhor paga do seu trabalho. Po
rque, se um cair, o outro levanta o seu companheiro  mas ai do que estiver só, caindo, não haverá outro que o
 levante» (Ecc 4:9:9-10). 
$UMPUTU KAKIMBEVO KO. Pobreza não é uma doença. «Ferida de dinheiro não é mortal» e «Pobreza não é vileza».$ 
$UMPUTU WAYINGI YELA NKANU. Muita pobreza faz perder o processo.$ 
A justiça sem a força é imponente  a força sem a justiça é tirânica» (Prov. fran- cês). Fala do dinheiro e cada um c
ala-se» (Prov. alemão). (French proverb). 
$UNDENDE N'DIMBA VWE, MYONGO VWE, MINI VWE, MPIPA VWE,NGEYE VO: «AVO YABAKA KANI KIVANGI DYAMBU KO». LUVUNU! WANA NKI KIVANGIDI MPASI MAKUMOLE YE NSAMBWADI MUKUNGINGA NDAMBU ZAWONSO? Perseguiu-me por nove vales, 
nove montanhas, durante nove dias e nove noites, e disse que se me apanhasse não me faria mal algum. 
Pura mentira! Porque me  perseguiu com tanto encarnecimento em todos esses lugares e tempos? pois não há ninguém que se imponha tantos sacrifícios inúteis sem intenção ou desígnio. Outrossim, quem persegue outra 
pessoa priva-se a si mesmo de repouso.$
$UNKETE O NSITA KETOKA YOVO: UMBANGU WA WINGI BANGUMURA. 
O óptimo é inimigo do bom. «O excesso em tudo é condenável mesmo na virtude e na justiça».$ 
$UNTENDA UN'OTENDELA YAYA, NGA NTU KU MOSI MINA E? Corta-me o cabelo como cortaste ao meu irmão. 
Mas as cabeças são iguais? Não há duas pessoas iguais no mundo. «Não seja imitador dos outros».$

elles identiques?
Roy). 
$UNU KYAME, MBAZI KYAKU, Hoje é meu dia, amanhã é o seu. Cada qual tem o seu dia de infortúnio. 
Se hoje é meu dia, amanhã poderá ser o seu. «Não há bem que sempre dure, nem mal que não acabe».$
 320 
$USWAMINI KUFUTA NKÉ, USWAMINI KUMBUNDU MBUTA YOVO: OYO USWAMINI KUMEFINDA NKÉ, OYO USWAMINI KUMBUNDU LUTIDI. Quem se escondeu na mata é menos inteligente do que quem se escondeu no seu coração. 
«O coração humano é uma fortaleza inexpugnável».$ 
$UTUDYA YE TATA, FITA KUMAKAYA. Vamos comer com o pai! O interesse do filho está em se regalar em detrimento do pai.$ «O mundo é governado pelo interesse pessoal» (Schiller). 321
