$YYAMBULA VANGA MBL KITUKA MUNTU WAMBOTE WAWU UNA YENTANGU, KADI KUZEYE KO OMA MAKUVINGILA KUNTWALA.
Desiste de fazer o mal e torna-te num homem de bem 
enquanto ainda tens tempo, pois não sabes o que te espera para a frente. «Não procedas como se tivesses de viver dez mil anos. 
O inevitável está suspenso sobre ti.$
 Enquanto viveres e quando te for possível, torna-te num homem debem» (Marco Aurélio).«Muitos santos são pessoas convertidas».Au
 rêle).
$YANDI NDYOY'ODYANGA YANDI IKUZENG'ENDYA. Quem come contigo é quem vai te envenenar.$
«O que mete comigo a mão no prato, esse me há-de trair» (S.Mat.: 26:23)
(St.Mat.:26:23).
(St.Matt.26:23).
$YANGALALA WALEMBA NUNA.Esteja alegre para não envelhecer.Esta afirmação categórica é uma importante sugestão consistindo em prolongar 
a juventude e em recuar a velhice na mente de quem aceita esta sugestão.$
, baseada na convicção de que «como pensa o homem na seu coração, assim ele é» segun-do a Bí
blia (Provérbios 23:7), parafrascada por Dr. Joseph Murphy nos seguintestermos: «Você é jovem quanto pensa que é. Tão f
orte quanto se julga. Tão útilquanto tem certeza de que é. E tão jovem quanto seus pensamentos» (The Powerof your S
ubconscious mind). A alegria prolonga a vida, pois, como o amor, a pazinterna, a paciência, o riso, ela não envelhece, mas tra
nsforma a velhice, quandoesta chega à maturidade, numa perspectiva serena e contempl
ativa do amanhã.345
$YANTIKA KAKUBADIDI KO, FOKOLA KUBADIDI.Não basta bem começar, basta, sim, bem acabar.$
«Melhor é o fim das coisas do que o princípio delas» (Eccl.7:9). «Tudo é bomquan
do acaba em bem».
$YAZINGA NKI NDIA, YA FWA NKI NSISA — YOVO: NZINGA NKINDIA MEWA NKI NSISA. Se eu viver que comer? Se eu morrer que deixar? A vida impõe-nos dois 
deveres: uma de trabalhar para viver e um outro tambémde trabalhar para deixar viver depois de nós, 
mesmo se soubermos que dentro depouco tempo morreremos.$ 
Sobre a preocupação do que havemos de deixardepois de nós, Martin Luther deu-nos uma estimulante motivação que deriva dasua convição de acção assim resumida: «Mesmo s
e eu crer que Jesus volta ama-nhã, plantarei ainda a mi
nha macieira hoje».346
$YELA VUMBU DYA NWA IZAYA ZENZA KAWA MENGA YE MAFINA.Sofrer de um abcesso na boca, é saber o sabor do sangue e do pus.O 
provérbio indica que quem já sofreu conhece o valor do sofrimento dos outrose pode ajudá-los.$ 
Daí, «só quem já chorou pode limpar as lágrimas de um outro».«Experiente da desgraça, aprendo a socorrer os infelizes» (Eneida, liv.i.v.)
$YE NATAMO KWANDI, AMBUT'ATALA MO.Vou provocar um acção antisocial, são os mais velhos que hão de resolvê-la.
Estas palavras são atribuídas aos jovens delinquentes que declaradamente fazem recair sobre os seus parentes as consequências das suas desordens sociais.$
$YE NKALAWONGA MBULANGENE YANDI, YE NYOKA UNTELE YAUKULUSUMBULA YE SUMBULA,.O lagarto que encontrei e a serpente que me mordeu são 
todos perigos seguidos.Trata-se de uma sucessão de incidentes perigosos, todos semelhantes, sobre osquais o desgraçado apela para a vigilância da 
sociedade com vista a conjurá-los eevitar a repetição de tais encontros estranhos e infelizes.$
347YE 
$NKINDISA KWANI, WAU E FUNGUTU KYA KOKO KYASALAKIKAKUNSONGANGA YOVO: YE NSADISA KWANI, WAU MUKUMVUMISA, E FUNGUTU KYA KOKO KYASALA KIKAKUNSONGANGA.
Ajudei-o a curar, e eis que ele me ameaça com o coto ou resto do braço que lhe ficou.$
«Os que de mim receberam a ciência do arco tomaram-me, no fim, como alvo»(Prov. Persa — Rosa Sha).mire» (Prov. Peran — Rosa Sha).
$YETO AWONSO MBOMBO MUNSI ZATALA.Todos nós, temos os narizes virados para a terra.Todos nós somos mortais.$
We are all mortal.
$YETO TUMVUKA MI DYA, MI YALUKA.Somos como largatas que comem numa árvore e emigram para uma outra.
Diz-se das pessoas que não estão permanentes num mesmo lugar.$
autre.348
$YETO TUYOLELA VO KATUVELELA KO, NGEYE DIAKA VA ZOLELEYOLELA.Nós que nos banhamos neste rio ainda não somos limpos, e tu também queres 
te lavar nele? Este adágio exprime o sentimento egoísta, 
exclusivista e de rejeição que manifes-tam certos residentes, regressados ou imigrantes num país, que se consideram os primeiros ocupantes da terra em relação aos novos imigrantes.$
$YE VOVELA KU MBUNDU AME. NANI OKONDA MBUNDU?Quero falar com o meu coração. 
Mas quem não tem o coração?Diz-se de alguém que pretende inibir-se de falar sob pretexto de falar consigo próprio, ignorando que os outros sabem também interiorizar os seus sentimentos.$
$YINKODI YOLE KUNA NTU NKWENO LUFUTU (LUFITA).Duas sovas na cabeça de alguém são uma prova de maldade.$
«Uma vez passa, duas vezes cansa, três vezes quebra». Mas Joseph Murphy, pelasua autoridade moral, manda parar até lá: «Nada de cometer o terceiro erro» (OPoder
 do Subconsciente — cap. 14, pp. 198-199).Miund, chap.14: 152-153).349
$YITU KAISOLWANGWA KO, AKUNDI ASOLWANGWA.Não se escolhe os seus pais, só amigos que se pode escolher.$«A sorte faz os pais, a escolha faz os amigos» (J. Delille).350
