description,language
"un avocat, pour défendre un accusé, doit aussi bien connaitre son histoire, et, ilen",Portuguese
"est de même pour celui qui veut défendre un cas quelconque, il doit en connaitre",Portuguese
"les tenants et les aboutissants, sinon le fétiche se toume contre le féticheur.",Portuguese
«Chaque homme est une histoire qui n'est identique à aucune autre» (Alexis,Portuguese
"Carrel - in «L/' Homme, cet inconnu»).",Portuguese
"If you want to defend a slave, you must know his history.",Portuguese
"In order to treat a sick person, a physician must know his pathological history, as",Portuguese
"a lawyer, in order to defend a defendant, must know his case; hence, any one",Portuguese
"who is willing to defend any case must know the ins and outs of that case, for, on",Portuguese
"the contrary, the fetish will tum against the fetishist.",Portuguese
«Every person is a history which is not identical to any other» (Alexis Carrel — in,Portuguese
"«L Homme, cet inconnu»).",Portuguese
"VUMU KITANDANGA, NTU KAUTANDANGA KO.",Portuguese
"A barriga esfomeada emagrece, mas a cabeça não emagrece. A fome",Portuguese
"É a barriga que pode emagrecer por causa da fome, mas a fome não se lê no",Portuguese
rosto.,Portuguese
"C'est le ventre qui maigrit, mais la tête ne maigrit pas.",Portuguese
"Pour cause de la faim, le ventre peut en maigrir mais cela ne peut pas se lire sur",Portuguese
le visage.,Portuguese
337,Portuguese
"The belly grows lean, but the head does not.",Portuguese
The hunger makes the belly grow lean but is not read on the face.,Portuguese
"VUMU KIYUKUTANGA, MESO KAMAYUKUTANGA KO.",Portuguese
"O ventre pode encher-se, mas os olhos nunca estão cheios e nunca se cansam",Portuguese
de ver.,Portuguese
"«O estômago esfomeado pode ficar farto, mas os olhos são insaciáveis» (Provérbio",Portuguese
Turco — R.Sha).,Portuguese
"Le ventre peut se rassasier, mais les yeux ne sont jamais rassasiés:",Portuguese
"«Le ventre affamé peut se rassaier, mais les yeux curieux ne sont jamais assou-",Portuguese
vis» (Proverbeturc - R.Sha).,Portuguese
The belly can be fed up. But the eyes are never filled up.,Portuguese
"«The hungry belly can be fed up, but the curious eyes cannot be filled up» (Turk-",Portuguese
ish proverb — R.Sha).,Portuguese
VUMU N'SUMBA KAUMENINANGA MBONGO KO.,Portuguese
O ventre é como o grande repositório de amendoins que não produz novas,Portuguese
sementes. -,Portuguese
«OQ ventre é consumidor e não produtor».,Portuguese
Le ventre est comme une grande réserve d'arachides qui ne produit pas de,Portuguese
nouvelles semences.,Portuguese
«Le ventre est un consommateur mais pas un producteur».,Portuguese
The belly (stomach) is as a depository of peanuts which does not produce new,Portuguese
seeds.,Portuguese
«The stomach is a consumer but not a producer».,Portuguese
VUVU I KUNZI DINATANG'E NZA.,Portuguese
A esperança é o pilar que suporta o mundo.,Portuguese
"«A esperança, por enganosa que seja, serve, quando menos, para nos levar ao fim",Portuguese
do destino por um caminho agradável» (La Rochefoucauld).,Portuguese
Yespérance est le pilier qui supporte le monde.,Portuguese
"«Lespérance, toute trompeuse qu'elle est, sert au moins à nous mener à la fin de",Portuguese
la vie par un chemin agréable» (La Rochefoucauld).,Portuguese
The Hope is the pillar which supports the world.,Portuguese
"Hope, though deceptive it may be, is at least of great use in leading us to the end",Portuguese
of our life through an agreeable way» (La Rochefoucauld).,Portuguese
338,Portuguese
