description,language
"Pour chaque chose, ce qui compte c'est de commencer.",Portuguese
«Une journée d'un millier de kilomêtres commence toujours par un premier pas»,Portuguese
(Prov. chinois). .,Portuguese
«Le commencement est la moitié du tout» (Platon).,Portuguese
"For any matter, the more important is to begin.",Portuguese
«A joumey of a thousand miles begins with one small step» (Chinese proverb).,Portuguese
«The beginning is a half way of all» (Plato).,Portuguese
KONSO DYAMBU YE NTANGU ANDL KONSO NTANGU YE DYAMBU DYANDI.,Portuguese
"Cada coisa tem o seu próprio tempo, e cada tempo tem uma coisa própria.",Portuguese
Refere-se à necessidade de fazer cada coisa no seu devido tempo e de reservar um,Portuguese
tempo para cada coisa.,Portuguese
"«Tudo tem o seu tempo determinado, e há tempo para todo o propósito debaixo",Portuguese
do céu» (Ecclesiastes 3:1).,Portuguese
«O tempo não poupa o que se faz sem ele» (François Fayolle — Larousse).,Portuguese
Il y a un temps pour chaque chose et chaque chose a aussi son temps.,Portuguese
Le proverbe se réfêre à la nécessité de faire chaque chose en son temps propre et,Portuguese
de réserver un temps pour chaque chose.,Portuguese
"«Tout a son temps déterminé, et il y a un temps pour chaque chose sous Je ciel»",Portuguese
(Eca. 3:1).,Portuguese
«Le temps n'épargne pas ce qu'on fait sans lui» (François Fayolle — Larousse).,Portuguese
"Everything has its time to be done, and every time has its business to be dealt",Portuguese
with.,Portuguese
"The saying suggests to do everything in due time, and to take time to do every-",Portuguese
thing.,Portuguese
"«AI has its determined time, and there is a time for everythingunder the heaven»",Portuguese
(Eccl. 3:1).,Portuguese
«Time does not spare what is done without it» (François Fayolle — in Larousse).,Portuguese
KONSO KIMA YE FULU KYANDL KONSO FULU YE KIMA KYANDI.,Portuguese
"Cada coisa no seu lugar, e cada lugar para cada coisa.",Portuguese
A ordem é uma lei divina que se manifesta em todo o universo e deve ser respei-,Portuguese
"tado, pois a desordem mata.",Portuguese
"Chaque chose à sa place et chaque place convient à une chose,",Portuguese
Lordre est une loi divine qui se manifeste dans tout I'univers et doit être respecté,Portuguese
car le désordre tue.,Portuguese
A place for everything and everything in its place.,Portuguese
Order is a divine law which is manifested in the whole universe and must be,Portuguese
respected because disorder kills.,Portuguese
126,Portuguese
"KONS'OMA MABWA, MABWA KWANDI, AMBUTA ATALA MO yovo",Portuguese
ALANDA MO.,Portuguese
"«Aconteça o que acontecer», são os mais velhos que tratarão do que acontecer.",Portuguese
Este provérbio exprime um sentimento de irresponsabilidade da parte de quem o,Portuguese
utilizaria.,Portuguese
"«Advienne que pourra», ce sont les adultes qui s'occuperont de ce qui pourrait",Portuguese
arriver,Portuguese
Ce proverbe exprime un sentiment d'irresponsabilité de la partde celui qui I'utiliserait.,Portuguese
"«Come what may», it is the old people who will deal with what may happen.",Portuguese
This saying expresses an irresponsible feeling from who would use it.,Portuguese
KONSO MBI FUTWA IFUTWANGWA.,Portuguese
Todo o mal se paga aqui na terra.,Portuguese
"«Em sentimento como na química, há um problema que creio ser",Portuguese
"verdade, é que nada se cria, nada se perde. De maneira que quando falhámos,",Portuguese
"acontece sempre um momento em que, sob a forma de sofrimento, de ruína, de",Portuguese
"doença, de remorsos... mesmo de morte, pagamos a adição» Maurice Donnay —",Portuguese
"in <La Douleureuse, acte >). .",Portuguese
Toute faute se paie ici-bas.,Portuguese
"«En sentiment comme en chimie, il y a un problême que je crois être vrai, c'est que",Portuguese
"nen ne se crée, rien ne se perd. De sorte que, Jorsque nous avons failli, il arrive tou-",Portuguese
"jours un moment oi, sous forme de souffrance, de ruine, de maladie, de remords ... et",Portuguese
"de mort même, nous payons I'addition.» (Maurice Donnay - La Douleureuse, Acte 1).",Portuguese
Every evil is paid in this world.,Portuguese
"«In feeling as in chemistry, there is a problem I believe to be true, that is nothing is",Portuguese
"created, nothing is lost. n such a way, when we've failed, it always happens one",Portuguese
"moment in which, in the form of suffering, of ruim, of iliness, remorses...and even",Portuguese
"of the death, we must pay the bill» (Maurice Donnay — in <La Douleurese, act-I>).",Portuguese
KONSO MUNTU MFUMU KAYIKILWANGWA.,Portuguese
Cada homem é mestre de si.,Portuguese
A máxima subentende que cada qual deve se respeitar a si próprio e respeitar,Portuguese
"também o seu próximo, criado como ele, à imagem e à semelhança de Deus.",Portuguese
Chaque homme est maitre de soi.,Portuguese
Cette maxime sous-entend que chacun doit se respecter lui-même et respecter,Portuguese
"son prochain créé, comme lui, à I'image et à la ressemblance de Dieu.",Portuguese
Every man is the master of his own.,Portuguese
This saying implies that everyone must respect oneself and respect also one's fel-,Portuguese
"low-man made, as oneself, in the image and after the likeness of God.",Portuguese
KONSO MUNTU MEUMU MUNA NZO ANDI.,Portuguese
Cada um é mestre em sua casa.,Portuguese
«Muito pode o homem em sua casa.»,Portuguese
127,Portuguese
Chacun est maitre dans sa maison.,Portuguese
«Charbonnier est maitre chez soi.»,Portuguese
Everybody is master in his house.,Portuguese
«A man's house is his castle».,Portuguese
KONSO MUNTU NKAZ'ANDI WA MBOTE.,Portuguese
A cada pessoa o seu cônjuge é bonito.,Portuguese
"«Quem o feio ama, bonito lhe parece, pois o desejo torna bonito o que é feio, e os",Portuguese
gostos não se discutem».,Portuguese
«O casamento e a mortalha no Céu se talham».,Portuguese
"A chaque personne, son conjoint est beau.",Portuguese
"«Il n'y a pas de laids amours, car le désir rend beau ce qui est laid,les goúts ne se",Portuguese
"discutent pas, et d'ailleurs les mariages sont écrits dans le ciel».",Portuguese
To everyone his consort is good.,Portuguese
"«There is no ugly lover, for desire beautifies what is ugly, there's no accounting",Portuguese
"for taste and security is in the eye of the beholder. Moreover, the weddings are",Portuguese
written in heaven».,Portuguese
KONSO MUNTU N'KUSU YE LUSENDE LWANDI.,Portuguese
Cada pessoa é um grande rato nkuzu que deve ser assado num espeto a sós.,Portuguese
Cada qual é uma pessoa importante que não deve ser confundida com outras pessoas.,Portuguese
Chaque personne est un grand rat-nkuzu à rôtir dans dans une brosse à lui seul.,Portuguese
Chacun est une personne importante qui attend qu'elle soit respectée et distin-,Portuguese
guée des autres.,Portuguese
Everyone is a great rat-nkuzu to be roasted in a split of its own.,Portuguese
Every person wants to be treated as an important one which must not be mixed,Portuguese
with other people.,Portuguese
KONSO MUNTU NSI ANDI YA MBOTE.,Portuguese
A cada um seu pais é bom.,Portuguese
"«O país de origem é doce, fosse ele uma tumba» (provébio árabe — citado por",Portuguese
M.Maurois — Larousse).,Portuguese
«A cada ave o seu ninho é bom».,Portuguese
"«Que o meu país tenha razão ou não, fica meu país» (G. K. Chesterton).",Portuguese
"Contudo, esse provérbio tem o seu oposto que afirma que: «onde alguém está",Portuguese
"bem, lá é a pátria» (Homero — Odisseia).",Portuguese
Trata-se de todo país de adopção em que um estrangeiro se sente em casa como,Portuguese
ou mais que em seu próprio país de origem .,Portuguese
«Cada ave canta os louvores do país onde passou a estação quente «(provérbio,Portuguese
Peul - citado por M. Maurois - Larousse).,Portuguese
A chaque homme son pays est beau.,Portuguese
"«Le pays natal est doux, fât-il une tombe» (proverbe Arabe — cité par M. Maurois",Portuguese
— Larousse).,Portuguese
"«Que mon pays ait tort ou raison, il reste mon pays» (G. K. Chesterton).",Portuguese
128,Portuguese
"Cependant, ce proverbe a son opposé qui affirme que: «Là oú I'on est bien, lã est",Portuguese
la patrie» .,Portuguese
Se dit de tout pays d'adoption oú un ressortissant étranger se sent chez lui autant,Portuguese
ou plus que dans son propre d'origine.,Portuguese
«Chaque oiseau chante les louanges du pays ou il a passé la saison chaude» (pro-,Portuguese
verbe Peul - cité par M. Maurois - Larousse).,Portuguese
To everybody his country is good.,Portuguese
"«The native country is sweet, should it be a grave» (Peul proverb — quoted by",Portuguese
M.Maurois — Larousse).,Portuguese
«Every bird finds its nest good».,Portuguese
"«Right or wrong, (it's) my country» (G. K. Chesterton).",Portuguese
"However, this proverb is opposed by another one which affirms: «where one is",Portuguese
"well, there is one's country».",Portuguese
"Jt is said of any adoptive country in which someone, as a foreign, makes himself",Portuguese
"at home, equally or more than in his own country.",Portuguese
«Every bird sings the praise of the country where it spent the warm time» (Peul,Portuguese
proverb — quoted by M. Maurois — Larousse).,Portuguese
KONS'ONA LEKELE KABASULA.,Portuguese
"Quem tiver a sua arma pronta, seja o primeiro a começar!",Portuguese
"Num encontro familial, depois das palavras de boas-vindas dos visitados aos visi-",Portuguese
"tantes, este provérbio é utilizado para pedir ao grupo que estiver na origem do",Portuguese
encontro de introduzir o assunto a tratar.,Portuguese
«Quem convida dá o banquete».,Portuguese
"Que celui qui a son arme préparée, soit le premier a commencer!",Portuguese
"Dans une rencontre familiale, aprês les paroles de bienvenue des visités aux visi-",Portuguese
"teurs, ce proverbe est utilisé pour demander au groupe qui est á I'origine de la",Portuguese
rencontre de prendre la parole pour introduire le problême à traiter.,Portuguese
«Celui qui invite donne le banquet».,Portuguese
He who has laid his snare may be the first to begin!,Portuguese
"In a family meeting, after the words of greetings to the visitors from the visited,",Portuguese
this saying is used to ask to the group which gave rise to the meeting to be the,Portuguese
first to introduce the matter to deal with.,Portuguese
«He who invites gives the banquet».,Portuguese
"KONSO NTI YE NSUNGI ANDI, YE MBUTU ANDI.",Portuguese
Cada árvore tem a sua estação e sua espécie de fruta.,Portuguese
Cada coisa tem o seu período e a sua utilidade.,Portuguese
Chaque arbre a sa saison et son genre de fruits.,Portuguese
Chaque chose a son temps et sa nécessité.,Portuguese
Every tree has its season and its kind of fruit.,Portuguese
Every thing has its period and its necessity.,Portuguese
129,Portuguese
KONSO NUNI ZALA DYANDI DYA MBOTE.,Portuguese
Cada ave acha o seu ninho bonito.,Portuguese
Cada qual sua casa é bonita.,Portuguese
«Muito pode o homem em sua casa».,Portuguese
A chaque oiseau son nid est beau.,Portuguese
Chaque homme trouve sa maison belle.,Portuguese
«Charbonnier est maitre chez soi».,Portuguese
Every bird finds its nest good.,Portuguese
«An Englishman's house is his castle».,Portuguese
«There is no place like home».,Portuguese
"KONSO SALU KIFWENE SALWA, TOMA KYO SALA, FULU KYAKU",Portuguese
KYESESA.,Portuguese
"Qualquer trabalho digno de ser feito, fá-lo bem, é o teu destino que tu prepa-",Portuguese
ras e iluminas neste mundo onde o passado não se repara nem se apaga.,Portuguese
"«Se algo vale a pena de ser feito, vale a pena de ser bem feito» (John Simpson).",Portuguese
"Tout travail qui vaut la peine d'être fait fais-le bien, c'est ton avenir que tu pré-",Portuguese
pares et illumine dans ce monde oú le passé ne se répare ni s'efface jamais.,Portuguese
"«Si quelque chose vaut la peine d'être fait, il vaut la peine d'être bien fait» (John",Portuguese
Simpson).,Portuguese
"Everything necessary to be done, do it well, it is your future that you prepare",Portuguese
and enlighten in this world in which you cannot rectify your mistakes nor,Portuguese
wipe them out.,Portuguese
"«If a thing's worth doing, it's worth doing well» (John Simpson).",Portuguese
"KOSI VILU, MAMBU VILU.",Portuguese
"Se mudares de lugar, os assuntos também mudam.",Portuguese
"«Costas viradas, linguagem mudada» (Prov. Malaio — R.Sha).",Portuguese
"«Patrão fora, dia santo na loja».",Portuguese
"Quand vous vous absentez, vos affaires changent aussi.",Portuguese
"«En tournant le dos, le langage change aussi» (Prov. Malais — R.Sha).",Portuguese
«Le chat parti les souris dansent».,Portuguese
"Whenever you are away, your business changes also.",Portuguese
"«When you are away, the language changes also» (Malaysian prov. R.Sha).",Portuguese
«When the cat is away the mice will play».,Portuguese
"KO YE KO WANDLI, NZADI YE NZADI ANDI.",Portuguese
"O sogro simpatiza com o seu genro, o cunhado com o seu cunhado.",Portuguese
O provérbio indica que os parentes por aliança estão unidos na alegria e na infeli-,Portuguese
cidade.,Portuguese
"Le beau-pêre sympathise avec son beau-fils, le beau-frêre avec son beau-frêre.",Portuguese
Cet adage indique que les parents par alliance sont unis dans la joie et dans les,Portuguese
malheurs.,Portuguese
130,Portuguese
"The father-in-law sympathizes with his son-in-law, and the brother-in-law",Portuguese
with his brother-in-law.,Portuguese
This saying shows that the in-laws are united through difficult and happy times.,Portuguese
KUBAKIDI NYOKA VA KATI KO.,Portuguese
Não apanhes uma serpente no meio.,Portuguese
Este provérbio aconselha de não se intrometer num assunto do qual se desconhe-,Portuguese
ce as entradas e saídas.,Portuguese
N'attrapez pas un serpent en son milieu.,Portuguese
Ce proverbe nous conseille de ne pas nous immiscer dans une affaire dont nous,Portuguese
ignorons les tenants et aboutissants.,Portuguese
Don't catch a snake in its middle.,Portuguese
This saying advises us not to meddle in a matter of which we don't know the ins,Portuguese
and the outs.,Portuguese
"KUBANZA KAVITANGA KO, SUKININA KAKA",Portuguese
(«VO NZAYA WO»: KU NIMA KAKA KAKWIZILANGA).,Portuguese
"O arrependimento não precede o erro, segue-o, ou «Se eu soubesse» chega",Portuguese
sempre tarde. .,Portuguese
"Este provérbio refere-se a alguém que reflecte tardiamente aoerro cometido,",Portuguese
como o ilustra La Fontaine na conclusão da sua fábula «O Corvo e a Raposa»:,Portuguese
"«Um pouco tarde: é certo — o corvo prometeu, Confuso e envergonhado: «Noutra",Portuguese
não caio eu!».,Portuguese
"Assim, o remorso é um escrúpulo que chega muito tarde quando a acção já é",Portuguese
cumprida.,Portuguese
"É por isso que se diz: «depois da casa roubada, tranca na porta».",Portuguese
«O arrependimento nunca chega cedo».,Portuguese
"La repentance ne précêde jamais I'erreur, elle vient toujours tard, ou «Si je",Portuguese
savais» arrive toujours trop tard.,Portuguese
Ce proverbe se réfêre a toute personne qui réfléchit tard aprês avoir commis la,Portuguese
"faute, comme l'illustre La Fontaine, dans la conclusion de sa fable «Le corbeau et",Portuguese
"le Renard»: «Le corbeau, honteux et confus, jura, mais un peu tard, qu'on ne I'y",Portuguese
prendrait plus».,Portuguese
"Ainsi, le remords est un scrupule qui vient trop tard quand l'action est déjà faite.",Portuguese
"C'est pourquoi Ion dit: «aprês la mort, le médecin».",Portuguese
"«Le remords ne précêde jamais, mais arrive toujours trop tard».",Portuguese
"Foolness precedes wisdom, or «If I knew» comes always late,",Portuguese
This proverb refers to all people who reflect only after having wronged as illus-,Portuguese
trated by La Fontaine in the conclusion of his fable «The Crow and the Fox»:,Portuguese
"«The crow, shamefaced and abashed, swore — but rather late — that he would not",Portuguese
be caught again in that way».,Portuguese
"Hence, the remorse is a scruple which comes very late after the action has been",Portuguese
done.,Portuguese
This is why people say: «It is a day after the fair»...,Portuguese
«Remorse never comes first» that is to say «after a foolish deed comes remorse».,Portuguese
131,Portuguese
KU DY'E NDOFI KO VO: «NKOKO WAU KILENDI WO NWINA,Portuguese
MAZA KO».,Portuguese
"Ninguém diga: «desta água não beberei», «pois ninguém sabe o futuro que o",Portuguese
guarda».,Portuguese
"«Não afirma nada por juramento, mesmo a verdade» (Meandres, Fragmentos —",Portuguese
citado por M.Maurois — Larousse).,Portuguese
"Ii ne faut jamais dire: «Fontaine, je ne boirai pas de ton eau», car vous ne savez",Portuguese
"pas ce qui vous attend dans I'avenir. Donc, «il ne faut jurer de rien».",Portuguese
"«N'assure rien avec serment, pas même la vérité» (Méandres - Fragments — cité",Portuguese
par M.Maurois — Larousse).,Portuguese
You cannot swear: «! won't drink of this water».,Portuguese
"Because in this world, you cannot know what the future holds for you.",Portuguese
Hence: «You never can tell».,Portuguese
"«Don't declare anything under oath, be it the truth» (Meandres — Fragments —",Portuguese
quoted by M.Maurois — Larousse).,Portuguese
KU FUTUMUKANGA MWISI NZO INA KO.,Portuguese
"Onde tem havido fumo, há uma casa.",Portuguese
Não há efeito sem causa.,Portuguese
"Oú il y a toujours de la fumée, il y a une maison.",Portuguese
Il n'y a pas d'effet sans cause.,Portuguese
"Where there is always smoke, there is a house.",Portuguese
There is not effect without cause.,Portuguese
"KU FWIDI MVIPI, MBEVO SIDI.",Portuguese
"Morreu um homem são, ficou o doente,",Portuguese
"Há doentes habituados às suas doenças, que sobrevivem a pessoas que, indiferen-",Portuguese
"tes do futuro, são surpreendidas por moléstias mortais.",Portuguese
"Portanto, «a morte, sentada à porta dos velhos espia os jovens e as pessoas sãs».",Portuguese
«Ninguém é tão novo que não possa morrer amanhã» (Provérbio Escandinavo —,Portuguese
R. Sha).,Portuguese
"Meurt un homme bien portant, alors que survit le malade.",Portuguese
"Il y a des gens habitués à leur état maladif qui survivent à des personnes qui, insou-",Portuguese
"cieuses de I'avenir, sont emportées par des maladies imprévisibles ou mal soignées.",Portuguese
"Ainsi, «la mort, assise à la porte des vieux, guette les jeunes et les hommes sains».",Portuguese
«Personne n'est si jeune qui ne peut pas mourir demain» (Prov. Scandinave — R.,Portuguese
Sha).,Portuguese
A healthy man dies while a sick man remains.,Portuguese
"Some people accustomed to their sickness survive to other persons who, regard-",Portuguese
"less of the future, are deadly surprised by some kinds of unexpected or poorly",Portuguese
treated sickness.,Portuguese
"Hence, «death is inevitable to the old people or sick men, but waits also unex-",Portuguese
pectedly for young and sound people».,Portuguese
«No one is too young that he cannot die tomorrow» (Scandinavian proverb.).,Portuguese
532,Portuguese
"KUKAYI KO YE KONZEKENA, NGEYE MPE AKUVANGILA WO.",Portuguese
"Não deves dar e recusar ao mesmo tempo, pois tarde ou cedo tu poderás ser",Portuguese
pago na mesma moeda.,Portuguese
O provérbio aplica-se aos que «envidam de falso» ou dão mostras de oferecer sem,Portuguese
"a verdadeira intenção de doar, pois retomam desonestamente por uma mão o que",Portuguese
dão por uma outra.,Portuguese
É o mesmo que dar a alguém uma coisa contra vontade ou com repugnância.,Portuguese
«Dar e reter não vale» (Antoine Loisel).,Portuguese
"N'offrez pas en refusant en même temps, car tôt ou tard on vous rendra la mon-",Portuguese
naie de votre piêce.,Portuguese
Ce proverbe s'applique à ceux qui font semblant de faire une offre sans Vinten-,Portuguese
"sion véritable de la donner, puisqu'ils reprennent malhonnêtement d'une main",Portuguese
ce qu'ils donnent de Vautre.,Portuguese
C'est donner à quelqu'un queique chose à contre-coeur.,Portuguese
«Donner et retenir ne vaut pas» (Antoine Loisel).,Portuguese
"Don't give and retain at the same time, because sooner or Later you” Il be given",Portuguese
«tit for tat».,Portuguese
The saying focuses on the double attitude of those who show proofs of giving but,Portuguese
don't have the least intention of doing so because they get back with one hand,Portuguese
what they have given with the other. This means also to begrudge someone,Portuguese
something when it is given unwillingly or reluctantly.,Portuguese
«To give and keep back is worth nothing» (Antoine Loisel).,Portuguese
"KU KISUTIDI FWA KO, MUNTU KAFWANGA MEWA ZOLE KO.",Portuguese
"Não tenhas pressa de morrer, pois não se morre duas vezes.",Portuguese
«Um dia de vida vale mais do que mil anos no outro mundo».,Portuguese
"Ne sois pas pressé de mourir, car on ne meurt pas deux fois.",Portuguese
«Un jour de vie vaut mieux que mille ans dans Iautre monde».,Portuguese
"Don't be in a hurry to die, because people don't die twice .",Portuguese
«A day in this life is better than one thousand years in the future life».,Portuguese
"KU KOMUNI KYUZU KIZOLELE VAIKA KO, KADI SAMA VO DIBENZELE,",Portuguese
"VO MUNTU SIDI NSINDU YOVO DYETE DYO, EKYUZU KIZOLELE VAIKA,",Portuguese
KIKOMOKENE YE KAKIVAIKA DYAKA KO.,Portuguese
Não inibas o salalé pronto a sair da sua termiteira. Quando a termiteira está,Portuguese
"humectada pelos orifícios de saída do salalé, este está pronto a sair e a voar;",Portuguese
"mas se um homem pisar a terra, o salalé estará impedido de sair.",Portuguese
Este provérbio aplica-se a pessoas dirigentes de grupos ou de organizações quais-,Portuguese
"quer, que coibem ou bloqueam ardilosa ou brutalmente as potencialidades huma-",Portuguese
nas susceptíveis de se desenvolver para o bem comum.,Portuguese
O profeta Isaías identifica o servo do povo áquele que: «não quebrará a cana tri-,Portuguese
"lhada, nem apagará o pavio que fumega; em verdade, produzirá o juízo» (Isaías",Portuguese
423).,Portuguese
"E ne faut pas inhiber les fourmis blanches de sortir de leur termitiêre. En effet,",Portuguese
lorsque la termitiêre est humectée par les orifices de sortie des fourmis blan-,Portuguese
133,Portuguese
"ches, celles-ci sont prêtes à sortir et à voler; mas si quelgu'un foule la terre, les",Portuguese
fourmis blanches sont empêchées de sortir.,Portuguese
Ce proverbe s'applique à des dirigeants de groupes ou organisations quelconques,Portuguese
qui répriment ou bloquent astucieusement ou brutalement les potentialités,Portuguese
humaines susceptibles de se développer pour le bien commun.,Portuguese
Le prophête Esaie identifie le serviteur du peuple à celui qui «ne brisera point le,Portuguese
"roseau cassé, ni n'éteindra la mêche qui brâle encore; il annoncera la justice",Portuguese
selon la vérité» (Ésaie 42:3).,Portuguese
Don inhibit the white ants to get out and fly from their termitarium. As a,Portuguese
"matter of fact, when the anthill is humected to open the ways to white ants to",Portuguese
"come out and fly, if someone treads upon, they will be inhibited to get out.",Portuguese
This saying is applied to persons who hinder the human potentialities necessary,Portuguese
to be developed for the good oí the people.,Portuguese
The prophet Isaiah said of the sérvant of the people: «a bruised reed shall he not,Portuguese
"break, and the smoking flax shall he not quench; he shall bring forth judgement",Portuguese
unto truth» (Isaiah 42:3).,Portuguese
KU KUNI NGUBA VA MESO MA NKEWA KO.,Portuguese
Não semeia amendoins sob o olhar dos macacos.,Portuguese
«É bom evitar de tomar riscos desnecessários» (A. & R. Flavell),Portuguese
«A discrição é a melhor parte do valor».,Portuguese
Ne semez pas des arachides sous le regard des singes.,Portuguese
«Il est mieux d'éviter de prendre des risques inutiles»,Portuguese
«La discrétion est la meilleure part de la valeur».,Portuguese
Don“ sow groundnuts while the monkeys are watching.,Portuguese
«It is better to avoid taking unnecessary risks»(A. & R. Flavell).,Portuguese
«Discretion is the better part of valour».,Portuguese
"KU KWENDA YANDIKO, KU MMANI NKUTA KO.",Portuguese
"Se não for junto com ele, não acabe o seu mantimento.",Portuguese
Não se pode ir até ao fim da viagem com um companheiro que põe os seus inte-,Portuguese
"resses acima dos demais, pelo que uma ruptura com ele se torna inevitável, e",Portuguese
quanto cedo melhor.,Portuguese
«O espírito de cada qual chegar a brasa à sua sardinha é incompatível com os,Portuguese
interesses de uma comunidade».,Portuguese
"Si vous n'allez pas avec lui, n'épuisez pas ses provisions.",Portuguese
On ne peut aller jusqu'au bout du voyage avec un compagnon qui met ses inté-,Portuguese
"rêts au-dessus de ceux des autres, de sorte que la rupture devient inévitable, et le",Portuguese
plus tôt le mieux.,Portuguese
"«L'esprit de tirer chacun la couverture à soi ou de se réserver la part de lion, est",Portuguese
incompatible avec les intérêts d'une communauté».,Portuguese
"If you don't go with him, do not finish his provisions.",Portuguese
People cannot go along until the end of the journey with a travelling companion,Portuguese
"who prejudices other fellows' interests; therefore, separation is inevitable, and",Portuguese
the sooner the better.,Portuguese
134,Portuguese
«The spirit of taking the lion's share in everything is incompatible with the inter-,Portuguese
ests of any community».,Portuguese
"KU KWENDA YE NUNU KO, AVO IZEYE NZIV'ANDI?",Portuguese
"Não vais com um velho, mas que fazer se é ele que conhece o seu caminho?",Portuguese
Recusar um serviço vital por desprezo de quem o possa prestar é dar prova de,Portuguese
uma indigência de espírito.,Portuguese
