description,language
Pas de joies sans ennuis.,Portuguese
No rose without thomns.,Portuguese
«There is not a good horse that never stumbles»,Portuguese
No joy without annoy.,Portuguese
KA VENA MWISI WA KONDA TIYA KO.,Portuguese
Não há fumaça sem fogo.,Portuguese
Não há efeito sem causa.,Portuguese
107,Portuguese
Il n'y a pas de fumée sans feu.,Portuguese
Un'y a pas d'effet sans cause.,Portuguese
There is no smoke without fire.,Portuguese
There is no effect without cause.,Portuguese
"KAWENGA, KAWENGA! KONSO MUNTU YE NKUMBU",Portuguese
ANDI. AVO KA NKUMBU AKU KO KUTAMBUDILA KO.,Portuguese
"Kawenga, Kawenga! Cada um tem o seu nome. Se não é teu nome, não respon-",Portuguese
das.,Portuguese
Este provérbio mostra que os nomes são identidades distintivas pelas quais os,Portuguese
seres humanos se diferenciam em indivíduos dotados de personalidades diferen-,Portuguese
"tes, pois não há dois indivíduos iguais no mundo.",Portuguese
"Kawenga, Kawengal A chacun son nom. Si ce n'est pas ton mom, n'y réponds pas.",Portuguese
Ce proverbe montre que les noms sont des identités distinctives par lesquelles les,Portuguese
"êtres humains se différencient en individus dotés de personnalités propres, ce qui",Portuguese
fait qu'il nºy ait pas deux personnes tout à fait égales au monde.,Portuguese
"Kawenga, Kawenga ! Everyone has his name. So if it is not your name, don't",Portuguese
accept the call. -,Portuguese
This saying shows that the names are identities by which the human beings are,Portuguese
differentiated as fellows endowed with a different personnality one from the,Portuguese
"other, so that there are no two men thoroughly equal over the world.",Portuguese
"KAYILA MUNTU MBIZI, LUMBU KI MOSI KA DYA YO,",Portuguese
"UNLONGI LOA, SE KADYA LUMBU YAWONSO.",Portuguese
"Oferece peixe a alguém, ele comerá um dia; ensina-o a pescar, ele comerá todos",Portuguese
os dias.,Portuguese
"Quem te ensina te torna igual ou superior a ele próprio, pois a instrução é poder",Portuguese
e é mais que riqueza.,Portuguese
«O saber é a parte mais considerável da felicidade» (Sófocles).,Portuguese
"Donnez à quelqu'un un poisson, il mangera un jour; enseignez-le à pêcher, il",Portuguese
mangera tous les jours.,Portuguese
"Qui t'enseigne te rend égal ou superieur à lui-même, car Vinstruction est pouvoir",Portuguese
et vaut plus que richesse.,Portuguese
«Le savoir est de beaucoup la portion la plus considérable du bonheur» (Sophocle).,Portuguese
"Give a fish to someone, he will eat one day; teach him to fish, he will eat",Portuguese
everyday.,Portuguese
"He who teaches you makes you equal or superior to himself, because knowledge",Portuguese
is power and is more important than riches.,Portuguese
«Knowledge is the more considerable part of happiness» (Sophocles).,Portuguese
"KAYILA MUNTU NKAMA LUMBU, UNYIMINA LUMBU KIMOSI KAKA,",Portuguese
"DIKAZAYIDILA NGEYE UMWIML YOVO NKAMA MVU KATUMAMA,",Portuguese
LUMBU KIMOSO KAKOLOMA IKIZAIDILWA.,Portuguese
"Ajuda alguém cem vezes e recusa-lhe a ajuda uma só vez, ele se lembrará ape-",Portuguese
nas da recusa.,Portuguese
108,Portuguese
O homem ingrato manifesta-se quando ele reconhece apenas o bem presente e,Portuguese
esquece os mil e um favores passados por causa do último que lhe foi recusado.,Portuguese
"Aidez quelqu'un cent fois et refusez-lui seulement une fois, il ne se souviendra",Portuguese
que du refus.,Portuguese
Vhomme ingrat ne reconnait que le bien présent et oublie les mille et une,Portuguese
faveurs reçues et dont seulement la derniêre lui a été refusée.,Portuguese
"Help someone hundred times and refuse him only once, he'll remember no",Portuguese
other thing than your refusal.,Portuguese
"The ungrateful man recognizes only the present good, and ignores all thousand of",Portuguese
favours received of which only a single one was denied him.,Portuguese
KAYILWA KA KAYANA KO.,Portuguese
Dar ou doar não é mear ou dividir por metade ou equitativamente.,Portuguese
«O mendigo não pode escolher.»,Portuguese
"Faire un don, ce n'est pas partager également.",Portuguese
«A cheval donné on ne regarde pas à la dent.»,Portuguese
To give a gift doesn't mean to share and share alike anything.,Portuguese
«Beggars cannot be choosers.»,Portuguese
"KAZU MU NW'A MBUTA, KINKADI NKADI KU MBUNDU.",Portuguese
"Um adulto mostra que a noz de cola é doce na sua boca, mas dissimula o dissa-",Portuguese
bor no seu coração.,Portuguese
Os jovens tentam imitar os adultos nas experiências em que estes «fazem das tri-,Portuguese
pas coração» perante situações desagradáveis da vida. Eles ignoram que os velhos,Portuguese
exteriorizam O prazer mas interiorizam a amargura das dificuldades da vida. Eles,Portuguese
"aplicam o adágio português: «na vida, antes causar inveja que dó».",Portuguese
"Un adulte montre que la noix de cola est douce dans sa bouche, mais dissimule",Portuguese
WYamertume dans son coeur.,Portuguese
"La jeunesse essaie d'imiter les adultes dans leurs expériences, qui, pourtant, «font",Portuguese
contre mauvaise fortune bon coeur». Ils ignorent que les «vieux» extériorisent le,Portuguese
plaisir mais intériorisent l'amertume des situations difficiles de la vie. Ils appli-,Portuguese
quent I'adage portugais «mieux vaut faire envie que pitié».,Portuguese
"An elder shows that the cola nut is sweet in his mouth, while he dissimulates",Portuguese
the bittemess in his heart.,Portuguese
The young people like to imitate old people when these «put bold face» on bitter,Portuguese
things of life. They ignore that old people exteriorize the pleasure but interiorize,Portuguese
the bitterness of everything. They apply.,Portuguese
The portuese proverb: «it is better to arouse envy than pity».,Portuguese
"KEMBO DYE NKISI, NGANGA KA KALA KIMOYO.",Portuguese
A força do fetiche depende do curandeiro vivo.,Portuguese
A protecção é assegurada enquanto o curandeiro estiver em vida.,Portuguese
"«Morto o bicho, morta a peçonha».",Portuguese
La force du fétiche dépend du devin en vie.,Portuguese
Ia protection est assurée aussi longtemps que le devin est en vie.,Portuguese
109,Portuguese
"«Morte la bête, mort le venin».",Portuguese
The fetish is effective only while the healer is alive.,Portuguese
The effectiveness of the fetish depends on the healer while alive.,Portuguese
«Dead men tell no tales».,Portuguese
«KATI NKYE NUNI IWOLELE VAVA?»: MWENE NSALA YE,Portuguese
MAVUSL OYUVULANGA DIAKA?,Portuguese
Que ave apodreceu-se aqui? Viu as asas e a penugem e pergunta ainda?,Portuguese
Este provérbio é utilizado para responder a alguém que faz uma pergunta pela,Portuguese
qual já tem a resposta pelo aquilo que está à vista.,Portuguese
Quel oiseau est pourri ici? Tu as vu les ailes et le duvet et tu poses encore des,Portuguese
questions? .,Portuguese
Ce proverbe est utilisé pour répondre à quelqu'un qui pose une question pour,Portuguese
laquelle il a déjà la réponse par ce qu'il voit.,Portuguese
"Which bird is putrid here? You've seen its wings and down, why do you ask then?",Portuguese
This saying is used to answer to someone who asks a question for which he has,Portuguese
already the answer through what he is seeing.,Portuguese
KETO DYA DINGI KETUKA.,Portuguese
A ambição extrema prejudica,Portuguese
"«Quem quer tudo, tudo perde».",Portuguese
Trop d'ambition nuit.,Portuguese
«Qui veut tout avoir perd tout».,Portuguese
Over-ambition leads to loss of all.,Portuguese
"«Grasp all, lose all».",Portuguese
"KEVA KA NDAMBU KO, VONGA K'AWOLE KO,",Portuguese
Ser pequeno não é ser meio-homem. E ser grande não vale por dois.,Portuguese
Esta máxima é uma resposta a pessoas arrogantes que tentam imporem-se pela impor-,Portuguese
tância de sua estatura e pelo desprezo dos semelhantes de baixa ou pequena estatura.,Portuguese
"Etre de petite taille, ne vaut pas un demi-homme, et être grand ne compte pas",Portuguese
pour deux hommes.,Portuguese
Ce proverbe constitue une réponse aux personnes arrogantes qui s'imposent à,Portuguese
leurs semblables qu'ils méprisent pour être de petite taille.,Portuguese
"To be small is not to be a half man, and to be tall does not count for two men.",Portuguese
This saying is an answer to arrogant persons which impose upon their fellow,Portuguese
beings of short stature.,Portuguese
KIBAKIDI MU NWA KO.,Portuguese
Não te agarro pela boca.,Portuguese
«Desculpa-me de te interromper de falar».,Portuguese
Interromper alguém usando a palavra para falar no seu lugar exige tacto e respeito.,Portuguese
Je ne vous prends pas à la bouche.,Portuguese
«Excusez-moi de vous interrompre de parler».,Portuguese
no,Portuguese
"Interrompre quelqu'un en train de parler en vue de parler en son lieu et place,",Portuguese
set fait avec tact et respect.,Portuguese
I don't seize you by the mouth.,Portuguese
«Excuse me to interrupt you to speak»:,Portuguese
To interrupt someone speaking in order to speak in his place requires tact and,Portuguese
respect.,Portuguese
KIDYA MENE MA SIKA LUNDA KYO.,Portuguese
"Yovo: KIDYA NSYUKA, MAKANI NKOKELA.",Portuguese
O que se come de manhã deve ser conservado na véspera.,Portuguese
«Poupa para o que der e vier».,Portuguese
«Mais vale prevenir do que remediar».,Portuguese
Ce que 1'on mange le matin doit être conservé la veille.,Portuguese
«Gardez une poire pour la soif».,Portuguese
«Mieux vaut prévenir que guérir».,Portuguese
What you'll eat in the morning must be kept the day before.,Portuguese
«Put something by for a rainy day».,Portuguese
«Prevention is better than cure».,Portuguese
KIDIA NTUNGI KO NZENZA KWE IKUMWENA.,Portuguese
Se eu não aproveitar da pessoa conhecida onde hei de encontrar o estrangeiro?,Portuguese
É um pretexto utilizado pelos abusadores dos bens alheios perante os quais a sua cobiça,Portuguese
"desenfreada não resiste. No entanto, opõe-se-lhes este outro provérbio árabe: «se o seu",Portuguese
"amigo é melífluo (de mel) não o coma todo inteiro, pois muito mel toma-se veneno».",Portuguese
"«Ame o seu vizinho, e não derrube a sua cerca».",Portuguese
"Si je ne profite pas du bien d'une personne connue, od trouverai-je celui d'un",Portuguese
étranger?,Portuguese
C'est un prétexte utilisé par ceux qui abusent des biens d'une personne connue,Portuguese
"dont ils s'emparent du bien convoité irrésistiblement. Cependant, un proverbe",Portuguese
"arabe nous dit que:«si ton ami est tout sucre et tout miel, ne le mange pas tout",Portuguese
"entier, car trop de miel devient poison».",Portuguese
"«Aime ton ami, et ne démolis pas son enclos».",Portuguese
"If I don't avail myself of an acquaintance's belonging, where will I find one",Portuguese
whose owner is a stranger?,Portuguese
This is a false pretext used by those who abuse of an acquaintance's property that,Portuguese
their irresistible ambition does not refrain to deviate by ali means in their power.,Portuguese
"However, an Arabic proverb advises us that «if your friend is all honey, don't eat",Portuguese
"him all through, because too much honey becomes poison».",Portuguese
"«Hence, love your friend, and do not throw down his enclosure».",Portuguese
"KIFWILANGA MUNTU, NTU KISIWANGA.",Portuguese
O que pelo qual alguém morre ou se sacrifica deve valer a pena que nele recli-,Portuguese
ne a cabeça.,Portuguese
"O provérbio significa que todo o esforço penoso deve ser compensador, é o que o",Portuguese
Apóstolo Paulo justifica pelos seguintes termos:,Portuguese
11,Portuguese
«Quem jamais milita a sua própria custa? Quem planta a vinha e não come do,Portuguese
seu fruto? Ou quem apascenta o gado e não come do leite do gado? (1 Co. 9:7).,Portuguese
La chose pour laquelle 1'on meurt ou Ion se sacrifie doit valoir la peine qu'on,Portuguese
y repose la tête.,Portuguese
"Le proverbe signifie que tout effort pénible doit être compensateur, c'est ce que",Portuguese
YApôtre Paul justifie en ces termes:,Portuguese
«Qui jamais fait le service militaire à ses propres frais? Qui est-ce qui plante une,Portuguese
"vigne et n'en mange pas le fruit? Qui est-ce qui fait paitre un troupeau, et ne se",Portuguese
nourrit pas du lait du troupeau? (1 Co. 9:7).,Portuguese
The thing for which one dies must be worth that one deserves to lie the head on it.,Portuguese
"This saying means that a painful effort must be compensating, it what the Apostle",Portuguese
Paul justífies by the following terms:,Portuguese
«Who serves as a soldier at his own expenses? Who plants a vineyard and does,Portuguese
not eat of its grapes? Who tends a flock and does not drink of the milk of the,Portuguese
flock? (1 Co. 9:7).,Portuguese
"KIKUNDI KIMANISANGA, KIMPANGI KA KIMANISANGA KO.",Portuguese
"A amizade pode acabar, o parentesco nunca acaba.",Portuguese
«O sangue é mais espesso do que a água».,Portuguese
"Lamitié peut finir, mais la parenté ne finit jamais.",Portuguese
«Le sang esit plus épais que l'eau».,Portuguese
"Brotherhood, even remote, is better than friendship.",Portuguese
«Blood is thicker than water».,Portuguese
KILUKILA MBUTA.,Portuguese
Mais vale prevenir do que remediar.,Portuguese
«Precaução demasia não prejudica».,Portuguese
«Um passo dado a tempo vale por nove».,Portuguese
«A prudência é a filha mais velha da sabedoria».,Portuguese
«A prudência ultrapassa as outras virtudes como a vista ultrapassa os outros sen-,Portuguese
tidos» (Bion de Boristhene — citado por Diógenes Laérce).,Portuguese
Mieux vaut prévenir que guérir.,Portuguese
«Prudence est mêre de sécurité ”.,Portuguese
«La prudence surpasse les autres vertus comme la vue surpasse les autres sens»,Portuguese
"(Bion de Boristhêne, cité par Diogêne Laérce).",Portuguese
Prevention is better than cure.,Portuguese
"«Safety first», and «a stitch in time saves nine».",Portuguese
«Prudence surpasses the other virtues as the sight surpasses the other senses»,Portuguese
(Bion de Boristhene — quoted by Diogene Laêrce).,Portuguese
KIMBANGI KYA WANTU WOLE KYA LUDI.,Portuguese
O testemunho de dois homens é verdadeiro.,Portuguese
"«Testemunha única, testemunha nula» (Caton).",Portuguese
Le témoignage de deux hommes est véritable.,Portuguese
"«Témoin unique, témoin nul» (Caton).",Portuguese
n2,Portuguese
The testimony of two men is valid.,Portuguese
"«Witness unique, witness non-existent» (Caton).",Portuguese
"KIMBEMBE UKIBABANGA, MAKUNZI MANDI KWA NZAMBI-MPUNGU.",Portuguese
O gavião que se põe em equilíbrio no ar tem o seu apoio em Deus Todo-Poderoso.,Portuguese
O provérbio mostra que as manifestações sobrenaturais que confundem a nossa,Portuguese
imaginação têm a sua origem no único poder de Deus que sustenta as acções de,Portuguese
todas as suas criaturas.,Portuguese
Lépervier qui se maintient en équilibre en I'air a son soutien en Dieu Tout,Portuguese
Puissant. :,Portuguese
Ce proverbe montre que les manifestations surnaturelles qui confondent notre,Portuguese
"imagination trouvent leur origine dans I'unique pouvoir de Dieu, qui soutient les",Portuguese
actions de toutes ses créatures.,Portuguese
"The sparrow-hawk which stays in balance in the air, has its support in God-",Portuguese
all-mighty. .,Portuguese
This saying shows that the supernatural manifestations which confound our,Portuguese
imagination stem from the unique power of God which sustains his all creatures”,Portuguese
actions. -,Portuguese
"KIMBEVO KIWUKWANGA, FU KYA MUNTU KA KIWUKWANGA KO.",Portuguese
Cura-se uma doença mas não um hábito.,Portuguese
"«O que o berço deu, a tumba o leva».",Portuguese
"On guérit une maladie, mais pas une habitude.",Portuguese
«Ce qu'on apprend dês le berceau dure jusqu'au tombeau» ou «le renard change,Portuguese
de poil mais non de nature».,Portuguese
"One can heal someone's sickness, but not a habit.",Portuguese
«What's bred in the bone will come out in the flesh».,Portuguese
KIMBEVO KOTA MU NITU NGOLO-NGOLO KANSI VAIKA MALEMBE,Portuguese
MALEMBE.,Portuguese
"A doença vem com toda a força, mas vai com lentidão.",Portuguese
"«A doença vem a cavalo, mas volta a pé» ou",Portuguese
«OQ mal entra às braçadas e vai às polegadas».,Portuguese
"«A doença entra no corpo pela boca do elefante, mas sai pela da formiga» (Pro-",Portuguese
vérbio Indiano — Rosa Sha).,Portuguese
"La maladie entre dans le corps à toute force, mais en sort lentement.",Portuguese
«La maladie vient au galop mais s'en retoume à pied» ou,Portuguese
«Le mal vient à cheval et sen retourne boiteux et contrefait».,Portuguese
"«La maladie entre dans le corps par la bouche de !'éléphant, mais en sort par celle",Portuguese
de la fourmi» (Proverbe Indien — Rosa Sha).,Portuguese
Sickness comes with might but goes away slowly.,Portuguese
«Sickness comes on horseback and goes away on foot».,Portuguese
"«Sickness enters into the human body by the mouth of the elephant, but leaves",Portuguese
through that of the ant» (Indian prov. - Rosa Sha).,Portuguese
n3,Portuguese
KIMFYETETE (KINONYA) KA KALA YE NTA KO NANGA,Portuguese
VO NGEYE UKUNTETA NGANGU ZIKONDELE YOVO,Portuguese
MBANGU UKONDELE.,Portuguese
A formiga não tem migalhas de came de sobra se aquele que vai despedaçá-la,Portuguese
não sabe retalhá-la.,Portuguese
Um problema bem apresentado por um primeiro orador pode ser encerrado sem,Portuguese
comentários pelos outros oradores se estes não souberem analisar certos outros,Portuguese
aspectos do problema que poderiam também comentar também aproveitáveis do,Portuguese
assunto.,Portuguese
La fourmi n'a pas de bribes de chair de surplus si celui qui va la dépiécer ne,Portuguese
sait pas s'y prendre.,Portuguese
Un problême bien présenté par un premier orateur peut rester sans commentaires,Portuguese
de la part des autres orateurs si ceux-ci ne savent pas analyser certains aspects du,Portuguese
problême qu'ils pourraient commenter à leur tour.,Portuguese
The ant does not have scraps of meat left over if he who will cut it does not,Portuguese
how to manage it.,Portuguese
A problem well presented by a first orator may remain without any comment,Portuguese
from the last orators if these ones cannot take advantage of other aspects of the,Portuguese
"problem, which could turn out profitable.",Portuguese
KIMFYETETE (KINONYA) KAZIKI MVUMBI KO NANGA VO KA,Portuguese
NKAZ'ANDIKO.,Portuguese
"Uma formiga não enterra um morto, se não for a sua mulher.",Portuguese
"O provérbio mostra que no reino animal, há animais incluindo o homem que",Portuguese
nunca deixam a vida e a honra da fêmea à mercê dos caprichos da natureza sem,Portuguese
lhe darem um forte amparo ou um devido enterro.,Portuguese
"La fourmi n'enterre pas de morts, à moins que ce soit sa femme.",Portuguese
"Le proverbe montre que, dans le rêgne animal, il y a des animaux, y compris",Portuguese
"Ihomme, qui ne laissent jamais la vie et 'honneur de la femelle à la merci des",Portuguese
"caprices de la nature, sans lui donner forte protection ou un enterrement digne",Portuguese
d'animal.,Portuguese
"An ant does not bury dead, unless it is its wife.",Portuguese
"This proverb shows that, in the animal realm, there are animals, including man,",Portuguese
which never leave the life and honour of the female to the freak of nature with-,Portuguese
out protecting or giving her an honoured burial.,Portuguese
"KIMFUMU KYAKU VO KYA NZALA ZA NGO, E KYA NKWENO MPE KYA",Portuguese
"NZALA ZA NGO, VO IKYAKU KYA NZALA ZA MBAMBI, KYA NKWENO",Portuguese
MPE KYA NZALA ZA MBAMBI.,Portuguese
"Se a tua autoridade deriva das garras de leopardo, a autoridade do outro tam-",Portuguese
bém deriva das garras de leopardo. Se a tua autoridade é feita das garras de,Portuguese
"jacaré, a autoridade do outro é também feita das garras de jacaré.",Portuguese
Este provérbio é uma referência ao respeito dos direitos dos outros como dos nossos,Portuguese
próprios.,Portuguese
«Não faz a outrem o que tu não querias que se te fizesse».,Portuguese
114,Portuguese
"Si ton pouvoir dérive des griffes de léopard, celui d'un autre provient aussi des",Portuguese
"griffes de léopard. Si ton pouvoir dérive des griffes de crocodile, celui d'un",Portuguese
autre provient aussi des griffes de crocodile.,Portuguese
Ce proverbe est une référence au respect des droits des autres comme les nôtres,Portuguese
propres.,Portuguese
«Ne fais pas à autrui ce que tu ne veux pas qu'on te fasse».,Portuguese
"If your power stems from the leopard's claws, that of another is made also of",Portuguese
"the leopard's claws. If your authority is made of the crocodile's claws, that of",Portuguese
another is also made of the same stuff.,Portuguese
This proverb is a reference to the respect of the rights of others as we do with our,Portuguese
own.,Portuguese
«Don't do to your fellow what you would not want him to do to you».,Portuguese
"KIMFUMU, MPU A KINSENGO: YÃLA, TUMBUKA.",Portuguese
O poder é como o chapéu da ave furta-cores cuja plumagem a enobrece e a des-,Portuguese
trona alternativa e periodicamente.,Portuguese
Este provérbio é uma demonstração da versatilidade ou inconstância do poder,Portuguese
político e do efeito de miragem dos cargos de prestígio que derivam dele. Este,Portuguese
poder é instável e depende muito do tempo e da sorte do seu detentor.,Portuguese
Le pouvoir est comme le chapeau de Voiscau au plumage changeant: il est,Portuguese
intronisé et détrôné alternativement et périodiquement.,Portuguese
Ce proverbe est une illustration de la versatilité ou inconstance du pouvoir politi-,Portuguese
que et de Ieffet de mirage des charges honorifiques qui en dérivent. Le pouvoir,Portuguese
est instable et dépend du temps et de la chance de son détenteur.,Portuguese
The power is as the hat of the coloured-bird (cock bird) with changeable,Portuguese
plumage: it is enthroned and dethroned alternatively and periodically.,Portuguese
This saying is an illustration of the inconstancy of the political power and the,Portuguese
mirage effect of the dignitary positions which stem from it. This power is instable,Portuguese
and is mainly dependent upon the time and its holder's chance.,Portuguese
"KIMFUMU TUMBWA, KA KITUMBA KO.",Portuguese
"Um chefe deve ser investido por uma instituição, mas não se deve impor por si",Portuguese
próprio.,Portuguese
O poder legítimo de um chefe deriva de sua escolha pelo povo soberano e não de,Portuguese
si próprio.,Portuguese
"- Un chef doit être investi par une institution, mais ne doit pas s'imposer lui-même,",Portuguese
Le pouvoir légitime d'un chef provient de son investiture par son peuple souve-,Portuguese
rain et non par lui-même.,Portuguese
"A chief must be invested with an office by an institution, but he does not",Portuguese
impose himself.,Portuguese
To be legitimated a chief must be chosen by his people and not by himself.,Portuguese
KIMFUSI KYA DYAMBU MFUMU A DYAMBU.,Portuguese
O empenho para tratar de um assunto depende do próprio dono.,Portuguese
«O cavalo engorda com a vista do dono».,Portuguese
115,Portuguese
Le zêle pour résoudre un problême dépend du responsable.,Portuguese
«Loeil du maitre engraisse le cheval».,Portuguese
The zeal to deal with a problem depends on the owner».,Portuguese
«The eye of a master does more work than both his hands».,Portuguese
"KIMFWA-MEWA, KIMPINGA-MPINGA, AVO KA MU MWANA KO MU",Portuguese
NTEKOLO.,Portuguese
"De geração em geração, as características genéticas transmitem - se senão dos",Portuguese
"pais aos filhos, pelo menos dos avós aos netos.",Portuguese
Este provérbio refere-se à manifestação de certas características dos pais nos seus,Portuguese
filhos das gerações presentes e vindouras através da hereditariedade ou do atavis-,Portuguese
mo.,Portuguese
"De génération en génération, les caractéristiques génétiques se transmettent",Portuguese
des parents à leurs enfants ou à leurs petits-enfants ou arriêres petits-enfants.,Portuguese
Ce proverbe se réfêre à la manifestation de certains caractêres héréditaires des,Portuguese
"pêres aux enfants, aux petits-enfants ou arriêre-petits-enfants par hérédité ou",Portuguese
atavisme.,Portuguese
"From generation to generation, the genetic character istics are transmitted from",Portuguese
"fathers to their sons, grandchildren or great-grandchildren.",Portuguese
This proverb refers to the manifestation of some characteristics of fathers through,Portuguese
"their children, grand-children or great-grand-children through heredity or",Portuguese
atavism.,Portuguese
"KIMVWAMA VO SADIDI KYO MANISA KIMANISANGA, NGANGU VO",Portuguese
SADIDI ZO WOKELA ZIWOKELANGA.,Portuguese
"A riqueza acaba pelo uso, a inteligência desenvolve-se e eleva-se pela sua utili-",Portuguese
zação.,Portuguese
"«O saber é uma coroa sobre a cabeça, enquanto que a riqueza não é senão uma",Portuguese
canga no pescoço» (Prov.Persa - Rosa Sha).,Portuguese
"Ia richesse se volatilise par son usage, l'intelligence s'agrandit et s'élêve par",Portuguese
son utilisation.,Portuguese
«Le savoir est une couronne sur la tête tandis que la richesse n'est qu'un joug au,Portuguese
cou» (Prov. Persan — Rosa Sha).,Portuguese
"Wealth comes to an end by its use, but learning increases by using it.",Portuguese
«Knowledge is a crown on the head whereas the wealth is but a yoke on the,Portuguese
neck» (Persan Prov. — Rosa Sha).,Portuguese
"KINA KIMWESANGA MPASI KWA MBEVO, KWA MVUMBI KYAMBOTE.",Portuguese
"O que faz sofrer o doente, convém ao morto .",Portuguese
Sofrer e ser vivo vale mais do que não sofrer por ser morto.,Portuguese
«Valer mais sofrer do que morrer é a divisa da vida» (La Fontaine).,Portuguese
A presença de um vivo no mundo é mais útil do que a simples lembrança de um,Portuguese
morto.,Portuguese
"Ce qui fait souffrir le malade, convient au mort.",Portuguese
116,Portuguese
