description,language
Le malafoutier tombé le matin est un avis pour les collecteurs du soir.,Portuguese
Le malheur d'autrui est une leçon pour les autres.,Portuguese
266,Portuguese
The collector of palm-tree's wine which fell in the morning is a warning for,Portuguese
the coliectors of the evening.,Portuguese
Another's misfortune is a lesson for others.,Portuguese
NSONI DYA ZIDYANGA.,Portuguese
A vergonha mata.,Portuguese
"«Quem se faz de mel, abelhas o lambem».",Portuguese
La honte tue.,Portuguese
"«Qui se fait brebis, le loup le mange».",Portuguese
Shame kills.,Portuguese
«Shame leads to inaction and finally to death».,Portuguese
"NSONI IZAKALA MU MESO, KALA VO MU MALU NGA YE WATELAMA",Portuguese
"LAKWA, YOVO: NSONI MUMESO, VO MUMALU NGA KILENDI",Portuguese
TELAMA KO.,Portuguese
"A vergonha manifesta-se nos olhos, se fossem nas pernas, ser-me-ia difícil de",Portuguese
andar.,Portuguese
A máxima mostra que a vergonha inibe e paralisa a acção da pessoa que ela afecta.,Portuguese
"La honte se manifeste dans les yeux, si c'était dans les jambes, il me serait dif-",Portuguese
ficile de marcher.,Portuguese
Cette maxime indique que la honte inhibe e paralyse même action de la per-,Portuguese
sonne qu'elle affecte.,Portuguese
"The shame is pervading in the eyes, if it were in the legs, I would not be able",Portuguese
to make any step.,Portuguese
This saying indicates that shame inhibits and paralyzes the action of whom it,Portuguese
affects.,Portuguese
NSONGO MYE SWEKA VONDA MIVONDANGA.,Portuguese
As dores de parto escondidas podem matar o bebé e/ou a mãe.,Portuguese
"Quem esconde o seu mal, priva-se de ser socorrido ou salvo de uma morte certa.",Portuguese
Les douleurs d'accouchement qu'on cache sont susceptibles de provoquer la,Portuguese
mort du bébé et/ou de la mêre.,Portuguese
Celui qui cache son mal se prive d'être aidé ou sauvé d'une mort certaine.,Portuguese
Hidden labour pains can cause death to the baby and/or to the mother.,Portuguese
He who hides his evil prevents himself from being assisted or saved from any,Portuguese
mortal danger.,Portuguese
"NSUDI A NWA VALAKYANA,",Portuguese
O hálito da boca evita-se mantendo-se a distância uns dos outros.,Portuguese
"«Afastem as suas tentas, aproximem os seus corações». «pedir às pessoas de vive-",Portuguese
"rem juntas, é pedir-lhes de se querelar».",Portuguese
"Pour éviter la mauvaise haleine de quelqu'un, il convient de se maintenir à",Portuguese
distance I'un de Vautre.,Portuguese
"«Eloignez vos tentes, mais rapprochez vos coeurs». «Demander aux gens de vivre",Portuguese
"ensemble, c'est leur demander de se quereller» (prov. Congolais).",Portuguese
267,Portuguese
"To avoid someone's foul breath, it is necessary to stand aloof one from the other.",Portuguese
"«Keep aloof your tents, but bring near your hearts». «If you tell people to live",Portuguese
"together, you tell them to quarrel» (Congolese prov.).",Portuguese
"NSUKI NKUTU YEWUTUKA ZAWU ZIKUNSISA, SUNGULA YENO MENO",Portuguese
"YE WANA KUMBASI,",Portuguese
"Se o cabelo com o qual nasci me abandona, o que não posso sofrer de vocês os",Portuguese
dentes que encontrei fora!,Portuguese
Este provérbio exprime um desprezo à ameaça de perder um bem da parte de,Portuguese
"quem já sofreu a perda de um bem maior, pois quem suportou uma grande",Portuguese
"perda, pode ainda suportar uma pequena. «Na adversidade dos nossos melhores",Portuguese
"amigos, encontramos muitas vezes algo que não nos desagrada» (François de La",Portuguese
Rochefaucould).,Portuguese
"Si les cheveux avec lesquels je suis né m'abandonnent, que ne puis-je, à plus",Portuguese
"forte raison, souffrir de vous les dents que j'ai trouvées à I'extérieur!",Portuguese
Ce proverbe exprime un mépris à la menace de perdre un bien de la part de celui qui,Portuguese
"a déjà perdu un plus grand bien, car qui a supporté une grande perte peut encore en",Portuguese
"supporter une petite. «Dans I'adversité de nos meilleurs amis, nous trouvons souvent",Portuguese
quelque chose qui ne nous déplait pas» (François de La Rochefaucould). -,Portuguese
"If the hair with which I was bom quittes me, what, all the more reason, I can-",Portuguese
not suffer from you the teeth I met outside!,Portuguese
This saying expresses a contempt of the threat of losing an important good from,Portuguese
"someone who has already lost a greater one, because he who supported a great",Portuguese
"loss can again support a small one. «In the adversity of our best friends, we often",Portuguese
find something which does not displease us» (François de La Rochefaucould).,Portuguese
NSUSU A MPEMBE KAKONDELE VATA KO.,Portuguese
A galinha branca não falta em aldeia nenhuma.,Portuguese
Os problemas existem em qualquer comunidade.,Portuguese
La poule blanche ne manque pas dans chaque village.,Portuguese
Les problêmes existent dans toutes les communautés.,Portuguese
The white hen is not absent in any village.,Portuguese
Problems are not absent in any family.,Portuguese
"NSUSU A NKENTO DIKAKOKOLWENDA, FINIFINI KYA LAKA.",Portuguese
A galinha cacareja por confrangimento.,Portuguese
"Por opressão excessiva, a natureza cede ou explode.",Portuguese
La poule caquette pour contrainte.,Portuguese
"Par trop de pression, la nature céde ou explose.",Portuguese
The hen cackles by constraint.,Portuguese
"Through much pressure, the nature yields or explodes.",Portuguese
"NSUSU KOKO, ATA KANWANA KO, MPASI MAVE KAVAVIDIKA.",Portuguese
"O galo, mesmo se não lutar, deve, pelo menos, eriçar as penas.",Portuguese
"O provérbio indica-nos que, nas situações críticas, devemos salvar as aparências,",Portuguese
268,Portuguese
como o diz Júlio Diniz na <Bíblia da Vida - Moral Leal>: «No mundo em que,Portuguese
"vivemos, há a verdade e há as aparências, e não basta somente atender a primei-",Portuguese
"ra, é preciso salvar também as outra».",Portuguese
"Le cog, même s'il ne lutte pas, doit, tout au moins, faire montre de sa força en",Portuguese
"hérissant ses plumes, en signe de défi.",Portuguese
"Le proverbe nous montre que, dans des situations critiques, nous devons sauver",Portuguese
"les apparences comme le dit Júlio Diniz, in <Bíblia da Vida - Moral Leal>: «Dans",Portuguese
"ce monde oú nous vivons, il y a la vérité et il y a aussi les apparences, il ne suffit",Portuguese
"pas d'accepter seulement I'une, il faut aussi sauver les autres.",Portuguese
"The coq, even if it'l] not struggle, must at least bristle up its feathers.",Portuguese
"This saying shows that in critical situations, we must save the appearances as said",Portuguese
"Júlio Diniz, in <Bíblia da Vida - Moral Leal «In the world in which we live, there",Portuguese
"is the truth, and there is the appearances also; there is no need to attend only to",Portuguese
"the truth, it is also necessary to save as well the other ones.",Portuguese
NSUSU MU KIMOSI KIMOSI KAYUKITILANGA.,Portuguese
"Pouco a pouco, a galinha enche-se.",Portuguese
«Grão a grão enche a galinha o papo» e «devagar se vai ao longe».,Portuguese
"Petit à petit, la poule remplit son jabot.",Portuguese
«Petit à petit 'oiseau fait son nid».,Portuguese
"Little by little, the hen fills the craw.",Portuguese
«Little strokes fell great oaks» and «little drops of water make the ocean».,Portuguese
"NSUSU UDYA NSONGONYA, MALU ZANGI-ZANGI.",Portuguese
Uma galinha que come formigas operárias anda com as patas no ar.,Portuguese
Dito de alguém que tira proveito de uma situação incómoda que está apressado a,Portuguese
abandonar.,Portuguese
Une poule qui mange les fourmis guerriêres marchent avec les pattes en I'air.,Portuguese
Se dit de quelgu'un qui profite d'une situation incommodante qui le met en,Portuguese
demeure de l'abandonner.,Portuguese
A hen eating driver ants has its feet in air.,Portuguese
Said of someone which avail oneself of a disagreeable situation.,Portuguese
NTAMBU A MBENDE MUNDEKA NDEKA UNA. YOVO: NTAMBU A,Portuguese
MBENDE KONSO MUNTU YE LEKO DYANDI.,Portuguese
Cada um tem a sua maneira de armar a ratoeira do rato-mbende.,Portuguese
«Cada um sabe as linhas com que se cose».,Portuguese
Chacun a sa maniêre de tendre le piêge de chaque genre de rat sauvage.,Portuguese
"«Même si deux hommes font la même chose, le résultat n'est pas le même».",Portuguese
The trap of rats depends on the rat-catcher.,Portuguese
Everyone knows what fits him best.,Portuguese
NTAMBU A NZENGENGE BAKA KWANDI MBIZI A NENE.,Portuguese
Uma pequena armadilha pode apanhar uma caça grossa.,Portuguese
«A chuva miúda acalma a ventania; a serenidade vence o furor».,Portuguese
269,Portuguese
Un petit piége peut attraper un gros gibier.,Portuguese
«Petite pluie abat grand vent».,Portuguese
A small trap can ensnare a big game.,Portuguese
«A small hole can sink a big ship».,Portuguese
NTAMBU A SANGA-NGUNGA KAMUFWANGA KI MOSIKO.,Portuguese
A teia de aranha não apanha apenas uma coisa.,Portuguese
Dito de uma coisa ou uma situação que arrasta mais consequências do que previsto.,Portuguese
La toile d'araignée n'attrape pas qu'une victime.,Portuguese
Se dit d'une chose ou d'une situation qui entraíne plus de conséquences que prévu.,Portuguese
The spider's web catches more than one thing.,Portuguese
Said of a thing or a situation that produces more things than one.,Portuguese
NTAMBU OKODILA KUSINA KAKUNDUNGU KO.,Portuguese
A armadilha é mais forte na base do que na sua alavanca (extremidade).,Portuguese
«A causa principal é mais importante que o efeito».,Portuguese
La force du piêge est assurée par sa base et non par son lévier (extremité).,Portuguese
«La cause principale est plus importante que Veffet».,Portuguese
The trap is stronger in its base than in its lever (extremity).,Portuguese
The cause of a matter is more importante than its effet.,Portuguese
NTANGU KAVINGILANGA MUNTU KO.,Portuguese
O tempo não espera por ninguém,Portuguese
«OQ tempo e a maré não esperam por ninguém».,Portuguese
Le temps n'attend personne.,Portuguese
«Le temps et la marée n'attendent personne».,Portuguese
The time does not wait for no one.,Portuguese
«The time and the tide don't wait for nobody».,Portuguese
NTANGU KA VUTUKANGA KUNIMA KO.,Portuguese
O tempo não recua.,Portuguese
«Aproveite enquanto há tempo».,Portuguese
Le temps ne retourne pas en arriêre.,Portuguese
«Battez le fer pendant qu'il est chaud».,Portuguese
Time does not go backward.,Portuguese
«Strike while the iron is hot».,Portuguese
"NTANGU NZIMBU,",Portuguese
O tempo é dinheiro.,Portuguese
«O tempo é a única riqueza de que se pode ser avaro sem desonra» (Chauvot de,Portuguese
Beauchêne).,Portuguese
270,Portuguese
"Le temps, c'est de I'argent.",Portuguese
«Le temps est la seule richesse dont on puisse être avare sans déshonneur»,Portuguese
(Chauvot de Beauchêne).,Portuguese
Time is money.,Portuguese
«Time is the unique riches of which one can be avaricious without dishonour»,Portuguese
(Chauvot de Beauchêne).,Portuguese
NTANTU AKU UNLANDI MU LUTAMBI KA MU NWA KO.,Portuguese
Siga o seu inimigo pelas suas peugadas e não pelas suas palavras.,Portuguese
O provérbio aconselha de seguir um adversário no seu raciocínio e não nos seus,Portuguese
erros de linguagem. «O principal é mais importante que o seu acessório».,Portuguese
Suivez votre ennemi par ses traces et non para ses paroles.,Portuguese
Le proverbe conseille de suivre un adversaire dans son raisonnement et non dans,Portuguese
ses-erreurs de langage. «Le principal est plus important que J'accessoire».,Portuguese
Follow your enemy through his tracks and not through his words.,Portuguese
This saying advises to follow one's adversary in his line of argument and to con-,Portuguese
sider not his slip of the tongue. «The principal is more important than its acces-,Portuguese
sory». .,Portuguese
NTANTU AKU MWISI NZO.,Portuguese
O seu inimigo é um membro de sua família.,Portuguese
«Os inimigos do homem são os membros da sua própria casa» (Miquéias 7:6).,Portuguese
«Não há pior inimigo que os seus familiares». «Ninguém é traido que pelos os,Portuguese
seus».,Portuguese
Ton ennemi c'est un membre de ta famille.,Portuguese
«Chcun a pour ennemis les gens de sa maison» (Michée 7:6). «On n'est jamais,Portuguese
trahi que par les siens». «Il n'est pire ennemi que ses proches».,Portuguese
Your enemy is a member of your family,Portuguese
«A man's enemies are the men of his own house» (Micash 7:6). «No one is,Portuguese
betrayed than by his near relations».,Portuguese
NTANTU KAKALANGA WA FYOTI KO.,Portuguese
Um inimigo nunca é pequeno.,Portuguese
"«Se tens por inimigo uma formiga, considera-a um elefante» (Prov. Árabe — Rosa",Portuguese
"Sha). «A águia dorme, mas o inimigo não.» (Prov. Árabe - Rosa Sha).",Portuguese
Un ennemi n'est jamais petit.,Portuguese
"«Si tu as une fourmi pour ennemi, considera-la un éléphant» (Prov. Arabe — Rosa",Portuguese
"Sha). «L'aigle dort, mais l'ennemi pas» (Prov. Arabe — Rosa Sha).",Portuguese
An enemy is never a small one.,Portuguese
"«If you have an ant as enemy, take it as an elephant» (Arabe prov. — Rosa Sha).",Portuguese
"«The eagle sleeps, but the enemy never» (Arabic prov. — Rosa Sha).",Portuguese
271,Portuguese
"NTEDI A MBILA OLUKA, NTAMBUDIDI A MBILA ZOWA.",Portuguese
Quem chama alguém é mais avisado do que o chamado.,Portuguese
Um homem não informado é a vítima predilecta do mentiroso. «Homem prevenido,Portuguese
vale por dois».,Portuguese
"Celui qui appelle quelqu'un est plus inteiligent que celui qu'il appelle,",Portuguese
Un homme non informé est une victime préférée du menteur. «Un homme averti,Portuguese
en vaut deux».,Portuguese
He who calls some one is more intelligent than whom he calls.,Portuguese
A imisinformed man is a favourite victim of the liar. «A warned man is half,Portuguese
saved» and: «Forewamed is forearmed».,Portuguese
"NTEKI NKWA MATULA, NSUMBI NKWA LUVWEZO.",Portuguese
"O vendedor sobrestima, o comprador subestima.",Portuguese
"«Quem encarece, quer vender caro; quem denigre, quer comprar barato». «Para",Portuguese
"vender, diz bem; para comprar, diz mal» (Prov. Árabe — Rosa Sha).",Portuguese
"Le vendeur surestime, W'acheteur sous-estime.",Portuguese
"Celui qui enchérit, veut vendre plus cher; celui qui dénigre, veut acheter bon",Portuguese
"marché». «Pour vendre, parle bien; pour acheter, parle mal» (Prov. Arabe — Rosa",Portuguese
Sha).,Portuguese
"The seller over-estimates, the buyer under-estimates.",Portuguese
"He who goes up in price, wants to sell dearly; he who denigrates, wants to buy",Portuguese
"cheaply». «To sell, speak well; to buy, speak bad» (Arab prov. - Rosa Sha).",Portuguese
"NTELA UMANISANGA, ALONGI KAMAMANISANGA KO.",Portuguese
"A estatura humana tem limite, mas os conselhos não têm fim.",Portuguese
"A estatura estanca-se, mas os conselhos continuam e estendem-se para toda a",Portuguese
vida. «Somos alunos até ao último dia da nossa vida: viver é aprender» (Lamarti-,Portuguese
ne).,Portuguese
"La taille prend fin, mais les conseils ne prennent pas fin.",Portuguese
"La taille cesse de croitre, mais les conseils continuent et s'étendent à toute la vie.",Portuguese
"«Nous sommes des écoliers jusqu'au dernier jour de notre vie: vivre, c'est appren-",Portuguese
dre» (Lamartine).,Portuguese
"The human height is limited, but the advise is limitless.",Portuguese
"The stature ends, but advice never ends. «We are pupils until the last day of our",Portuguese
life: life is learning» (Lamartine).,Portuguese
"N'TETE A NENE KA USAKWANGA LUMOSO KO, DYAMBU DYA NENE",Portuguese
KADIVOVWANGA NZENGENGE KO.,Portuguese
"Um fardo pesado não pode ser soerguido pela a mão esquerda, e um grande",Portuguese
assunto não pode ser tratado com leviandeza.,Portuguese
«Para grandes males grandes remédios».,Portuguese
"Un pesant fardeau ne peut pas être soulevé par la main gauche, ni une grande",Portuguese
affaire être traitée avec légêreté.,Portuguese
«Aux grands maux les grands remêdes».,Portuguese
272,Portuguese
A heavy burden cannot be lifted up with the left hand nor an important matter,Portuguese
be treated without due reflexion.,Portuguese
«Desperate ills call for desperate remedies».,Portuguese
N'TET'A NYANGA (NDYIANGA) UVITIDI KU NLUDI A NZO.,Portuguese
"É um feixe de ervas colocada antecipadamente em cima do tecto a cobrir, ante-",Portuguese
cedendo os que vierem a seguir.,Portuguese
Dito por alguém que é o primeiro a oferecer a sua contribuição material a uma famí-,Portuguese
"ka afectada, em nome do seu grupo cujas contribuições solidárias virão a seguir.",Portuguese
"C'est un premier faisceau d'herbes déposé sur le toit à couvrir, dont les autres",Portuguese
suivront.,Portuguese
Ce proverbe est dit par quelqu'un qui donne sa contribution matérielie à une,Portuguese
"famille aifectée, au nom de son groupe dont les contributions suivront et s'ajou-",Portuguese
teront à la sienne.,Portuguese
Jt is a bundle of straw on the roof to be covered as the first of the others which,Portuguese
will follow.,Portuguese
Said by some one who is the first to give his material contribution to an affected,Portuguese
"family, on behalf of his group whose contributions will follow.",Portuguese
"NTET'A WUTUKA YIZAYAKANA, NTET'A FWA KA YIZAYAKANANGA KO.",Portuguese
Pode se conhecer os primeiros nascidos mas não os primeiros a morrer.,Portuguese
"Conhece-se 0 passado, mas o futuro pertence a Deus.",Portuguese
«A morte chega inesperadamente sem respeitar a precedência estabelecida pelo,Portuguese
nascimento dos homens».,Portuguese
"On peut savoir les premiers nés, mais pas les premiers a mourir.",Portuguese
«La mort arrive à l'improviste sans respecter la précédence établie par la naissan-,Portuguese
"ce des hommes». On connait le passé, mais le futur appartient à Dieu.",Portuguese
"K is possible to know the first bom, but not the first to die.",Portuguese
"«Death happens unexpectedly, irrespective of the precedence derived from the",Portuguese
"human's birth». We know the past, but the future belongs to God.",Portuguese
N'TETE KUFULA VATA UZITILANGA YOVO: ZITU KUFULA VATA,Portuguese
DIZITILANGA.,Portuguese
O fardo torna-se mais pesado na aproximação da aldeia.,Portuguese
«As dificuldades aumentam à medida que se aproxima do alvo». «Semear é,Portuguese
"menos penoso do que ceifar» (Goethe, in «Maximen und Reflexionen» - citado",Portuguese
por M. Maloux — Larousse).,Portuguese
Le fardeau devient plus pesant à Vapproche du village.,Portuguese
«Les difficultés augmentent à mesure que l'on s'approche du but». «Semer est,Portuguese
moins pénible que moissonner» (Goethe in «Maximen und Reflexionen» — cité,Portuguese
par M. Maloux - Larousse).,Portuguese
The burden becomes heavier nearer the village.,Portuguese
«The difficulties increase as one comes closer to the aim».,Portuguese
«To sow is less painful than to harvest» (Goethe in «Maximen und Reflexionen»,Portuguese
quoted by M. Maloux — Larousse).,Portuguese
273,Portuguese
"NTETE SUZI (SUZA) KYA NZAMBLI, ZOLE VILAKANA, TATU LUKANU.",Portuguese
"Uma primeira vez é um acidente e não conta, uma segunda vez é esquecimento,",Portuguese
mas uma terceira vez é feita de propósito.,Portuguese
O provérbio indica que errar uma primeira vez não conta por ser um acidente ou,Portuguese
"por ignorância, uma segunda vez é tolerável pois pode ser por esquecimento ou por",Portuguese
"descuido, mas uma terceira vez é condenável por ser intencional e por obstinção.",Portuguese
"Por isso, «é preferível deixar uma ofensa repetir-se, pelo menos, três vezes: a pri-",Portuguese
"meira ofensa é por acidente, a segunda por engano, a terceira é provavelmente",Portuguese
"por intenção» (G. T. Zona). «Uma primeira vez passa, uma segunda vez cansa,",Portuguese
uma terceira vez quebra» (H. V. Roy).,Portuguese
"Une premiere fois est un accident, et ne compte pas, une seconde fois, c'est par",Portuguese
"oubli, mais la troisiême fois, c'est de propos délibéré.",Portuguese
"Ce proverbe indique que se tromper une premiêre fois ne compte pas, car c'est",Portuguese
"par accident ou par ignorance; une seconde fois est tolérable, car c'est par oubli",Portuguese
"ou par inadvertance; une troisiême fois est condamnable, car manifestement c'est",Portuguese
"fait á dessein ou par obstination. Pour cela, «il est mieux de laisser une offense se",Portuguese
"répéter au moins trois fois: la premiêre offense c'est par accident, la seconde c'est",Portuguese
"par erreur, et la troisiême fois, c'est probablement par intention» (G. T. Zona).",Portuguese
"«Une premiêre fois passe, une seconde fois lasse, une troisiême fois casse» (H. V.",Portuguese
Roy).,Portuguese
"Once is an accident and does not count, twice is forgetfulness (carelessness)",Portuguese
oblivion but the third time is with a fixed purpose.,Portuguese
This saying shows that to wrong once does not count because it is by accident or,Portuguese
"by ignorance, to wrong twice is tolerable for it is by forgetfulness or carelessness;",Portuguese
but to wrong three times is unbearable because it is obviously on purpose.,Portuguese
For that «it is better to let an offence to be repeated at least three times: the first,Portuguese
"offence may be an accident, the second a mistake, but the third one is likely",Portuguese
"intentional» (G. T. Zona). «Once passes, twice wearies, three times break».",Portuguese
N'TETE VENA VEMBO DYA MUNTU A NKAKA WASAKALALA,Portuguese
UMONEKENANGA.,Portuguese
O fardo sobre o ombro de um outro homem parece sempre leve.,Portuguese
"«Pois atam fardos pesados e difíceis de suportar, e os pôem aos ombros dos",Portuguese
"homens, eles porém nem com o dedo querem movê-los» (St.Mat.23:4).",Portuguese
Le fardeau sur 'épaule d'un autre homme semble toujours léger.,Portuguese
"«ls lient des fardeaux pesants et les mettent sur les épaules des hommes, mais ils",Portuguese
ne veulent pas les remuer du doigt» (St.Mat.23:4).,Portuguese
The burden on another man's shoulder is always light.,Portuguese
"«For they bind heavy burdens and grievous to be borne, and lay them on men's",Portuguese
shoulders but they themselves will not move them with one of their fingers»,Portuguese
(St.Mat. 23:4).,Portuguese
"NTI MYA NGANGA MUTONDA MYO, MBEVO KAKINDA.",Portuguese
Os medicamentos do curandeiro são aprovados se o doente é curado.,Portuguese
"«Não há cura do doente, não há aprovação da medicação».",Portuguese
274,Portuguese
Les médicaments du guérisseur ne sont approuvés que si le malade est guéri.,Portuguese
"«Pas de guérison, pas d'approbation de traitement».",Portuguese
The healer's medicine is proved only if the sick is healed.,Portuguese
"«No cure, no medicine».",Portuguese
"NTIMYA SOLA, KUNA MYABWA, KUNA DYAKA MYABWA.",Portuguese
As árvores da floresta devem cair de um lado e de um outro também.,Portuguese
"Na sociedade, a ajuda deve vir de todos os seus membros. «A união faz a força, a",Portuguese
desunião é fraqueza».,Portuguese
"Les contributions familiales sont comme les arbres de la forêt, qui tombem",Portuguese
d'un côté comme de l'autre.,Portuguese
"Dans la société, 'aide doit être apportée par les uns et les autres de la famille.",Portuguese
"«Lunion fait la force, a désunion est faiblesse».",Portuguese
"The contributions of the family are as the trees of the field, they must fall from",Portuguese
all parts.,Portuguese
"In a society, help must come from ail its members. «Union is strength, disunity is",Portuguese
weakness».,Portuguese
"NTINU KANA ZIKONDA, KUBUKUBU KADIKONDI KO.",Portuguese
"Se faltar o essencial, não faltará o secundário.",Portuguese
"Na falta do melhor, contenta-se do menor. «Um pouco vale mais do que nada».",Portuguese
Il peut nous manquer l'essenciel mais pas le sécondaire.,Portuguese
"À défaut du mieux, il faut se contenter de ce qu'on a. «Un peu vaut mieux que rien».",Portuguese
"Tf there is no surplus of what we need, the least necessary will do.",Portuguese
"Where the best is impossible, the least can be useful. For want of something bet-",Portuguese
"ter, let us be content with the least.",Portuguese
NTI UVONDANGA NYOKA LANDAKESA.,Portuguese
O pau que mata a cobra deve lhe ser aplicada repetidamente.,Portuguese
«Faz-se sempre depressa o que se faz bem» (César Augusto). «O abutre aperta a,Portuguese
galinha até ao último suspiro» (Prov. Russo — Rosa Sha).,Portuguese
Le bãton qui tue le serpent doit lui être appliqué sans répit.,Portuguese
«On fait toujours assez vite ce que Ion fait assez bien» (César Auguste). «Le,Portuguese
vautour resserre la poule jusqu'au dernier soupir» (Prov. Russe — Rosa Sha).,Portuguese
The stick that kills the snake must strike it repeatedly.,Portuguese
«One does always quickly whatever must be done quite well» (César Auguste).,Portuguese
«The vulture squeezes the hen until it breathes its last» (Russian prov. - Rosa Sha).,Portuguese
"NTI WABWISA NZAWU NKAMA, NZAWU NKAMA MPE",Portuguese
ATELEMESANGA WO.,Portuguese
"Uma árvore derrubada por cem elefantes, deve ser levantada por cem elefantes,",Portuguese
"«A união faz a força, a desunião é fraqueza».",Portuguese
Un arbre abattu par cent éléphants doit être soulevé par cent éléphants.,Portuguese
"«Lunion fait la force, la désunion est faiblesse».",Portuguese
275,Portuguese
A tree pulled down by a hundred elephants must be lifted again by a hundred,Portuguese
elephants.,Portuguese
«Unity is strength». «Many hands make light work».,Portuguese
NTI WASIMBA MBUTA KAUNINGANANGA KO.,Portuguese
O ceptro segurado por um velho não oscila.,Portuguese
Um compromisso assumido por um adulto é certo de ser honrado.,Portuguese
Le sceptre tenu par un vieux ne peut pas osciller.,Portuguese
